{
  "schema_version": "1.2.0",
  "project_id": "20260817_DXPO",
  "scene_id": "20260817_DXPO",
  "reconstruction_id": "20260817_DXPO-fixed-rig",
  "project_name": "20260817_DXPO",
  "scene_package_id": "20260817_DXPO-fixed-rig-spzv4-495a985dfdf1",
  "unit": "meter",
  "coordinate_system": {
    "right_axis": "X",
    "up_axis": "Y",
    "forward_axis": "Z",
    "ros": {
      "handedness": "right",
      "x": "forward",
      "y": "left",
      "z": "up"
    },
    "viewer": {
      "handedness": "right",
      "x": "right",
      "y": "up",
      "z": "backward"
    },
    "T_viewer_ros": {
      "translation": [
        0.0,
        0.0,
        0.0
      ],
      "rotation_xyzw": [
        -0.5,
        0.5,
        0.5,
        0.5
      ]
    }
  },
  "dynamic_overlay": {
    "topic": "/box/relative_transform",
    "freshness": {
      "timeout_ms": 500,
      "on_timeout": "hide",
      "ordering": "ros_stamp"
    }
  },
  "metric_reconstruction": {
    "manifest_uri": "metric_reconstruction/manifest.json",
    "manifest_sha256": "7355dc73867d03b32a1d2fb9b1616dd7c64a8a7a54d4a588c1d9a9ed38972bc9"
  },
  "assets": {
    "splats": [
      {
        "id": "primary",
        "role": "overview",
        "uri": "splats/20260817_DXPO.spz",
        "lod": false,
        "paged": false,
        "source_format": "spz",
        "runtime_format": "spz",
        "coordinate_stage": "horizontalized_lfs",
        "sha256": "5137b4369ac155e3632e5392379f7973c398295310b9406d401fbf3c6c3cd4e1"
      }
    ],
    "proxy_mesh": null,
    "human_models": []
  },
  "configs": {
    "world_alignment": "config/world_alignment.json",
    "camera_presets": "config/camera_presets.json"
  },
  "annotations": {
    "apriltag_corners_world": "annotations/apriltag_corners_world.json",
    "fixed_tag_map": "annotations/fixed_tag_map.json"
  },
  "licenses": {
    "notice": "licenses/scene_notice.md"
  },
  "capabilities": {
    "display": true,
    "measurement": false,
    "surface_placement": false,
    "fov": false,
    "occlusion": false
  },
  "provenance": {
    "gaussian": {
      "source_format": "spz",
      "source_sha256": "5137b4369ac155e3632e5392379f7973c398295310b9406d401fbf3c6c3cd4e1",
      "runtime_format": "spz",
      "runtime_sha256": "5137b4369ac155e3632e5392379f7973c398295310b9406d401fbf3c6c3cd4e1"
    },
    "coordinate_stage": "horizontalized_lfs",
    "decoder_coordinate_contract": {
      "id": "spark_spz_decoder_rx180",
      "rotation_quaternion_xyzw": [
        1.0,
        0.0,
        0.0,
        0.0
      ],
      "annotation_source": "xyz_aligned"
    },
    "metric_tracking": {
      "status": "verified",
      "reason": null
    },
    "project_name": "20260817_DXPO",
    "external_stage": "LichtFeld Studio",
    "distribution_projection": {
      "kind": "display_apriltag_only",
      "source_schema_version": "1.3.0",
      "self_contained_dataset_included": false,
      "omitted": [
        "registered_images",
        "person_masks",
        "colmap_masks",
        "colmap_database"
      ]
    }
  }
}
